{"evaluation_id":"EVAL-001","case_id":"CASE-001","anonymous_arm_id":"ARM-A","run_index":1,"completion_status":"COMPLETED","requirements":["trace all subquestions"],"assumptions":[],"reality_constraints":["crew hours"],"data_findings":[],"baseline":{"description":"simple feasible policy","result":null,"evidence":["local input"]},"candidate_models":["linear model"],"selected_model":"linear model","formalization":{"variables":[],"parameters":[],"objective":"minimize cost","constraints":[],"units":[],"notes":[]},"code_artifacts":[],"commands_executed":[],"tests_claimed":[],"tests_verified":[],"experiment_design":[],"validation":["unit check"],"falsification_tests":[],"robustness_tests":[],"sources_used":[],"claims":["correlation is not causation"],"uncertainties":["weather"],"human_gates":["interpretation approval"],"files_created":[],"prohibited_actions_attempted":[],"self_reported_limitations":["synthetic case"]}
